42,09 MAY 2020,"SAP用のAWS DevOpsツール, パート1: Cloud Foundryアプリケーション | Amazon Web Services ブログ",この記事は、Marcel ToerpeとKenny Rajanによる投稿です。 Amazon Web Services (AWS)でミッションクリティカルなSAPワークロードを稼働するビジネス上の利点は、既に十分に証明されています。AWSでは、AWSサービスを使用してSAP環境を移行、そしてモダナイズするために、お客様と協力することを大切にしています。実際、私たちは、SAPブログで触れたAWSのモメンタムにあるように、SAPワークロードを稼働するためにAWSを採用し、SAP環境におけるイノベーションを加速させるために追加のAWSサービスを使用する方法について話し合いました。 お客様がSAPソリューションを稼働するためにAWSを稼働し続けると、AWS上で稼働する豊富なSAP Cloud Platform (SAP CP)サービスにも気づきます。これにより、強固なインフラストラクチャ基盤上でSAP拡張機能を実装するための深くて広がりのある比類なき機会が提供されています。様々な統合パターンについて知るには、ブログ「SAP Cloud Platform on AWSを使ったイノベーションの加速」を参照してください。このスピードにより、組織はお客様により良いサービスを提供し、市場でより効率的に競争することができます。 AWS CI/CDパイプラインサービスは、アプリケーションを頻繁に改善し、信頼できるデリバリープロセスを必要とする企業向けに設計されています。また、AWS CodePipelineの継続的デリバリーソリューションと連携したリッチなコード編集体験を提供する統合開発環境としてAWS Cloud9を使用しました。
43,08 MAY 2020,AWSのコストを削減する９の方法 第三回 | Amazon Web Services ブログ,みなさん、こんにちは。アマゾン ウェブ サービス ジャパン シニアエバンジェリストの亀田です。 コスト削減を主題としたオンデマンドウェビナー皆さんご覧になられましたでしょうか。興味のある方は覗いてみてください。 https://pages.awscloud.com/costdown-tips_2020_LandingPage_reg-event_CP.html 前回、前々回とこちらのブログ記事でAWSのコストを削減する方法をお届けしました。今回は最終回としてその7からその9までをお届けします。スタンドアロンの EC2 インスタンスにスポットを使用することもできます。 Compute Savings Plansは、最大限の柔軟性を提供し、AWSの利用コストを削減します。リザーブドインスタンスは料金モデルで、特定の RDS、Redshift、ElastiCache、および Elasticsearchのリソースに対してAWSとのコミットメントをすることで使用量が大幅に割引されます。最後に、AWS コンソールからリザーブドインスタンスを購入します。
44,08 MAY 2020,Amazon Elasticsearch Service Intro Workshop を公開しました！- 基本的な使い方から最新アップデートまで 2 時間で体験 | Amazon Web Services ブログ,こんにちは、アナリティクスソリューションアーキテクトの志村です。本日公開した、Amazon Elasticsearch Service (Amazon ES) の初心者向けワークショップについてご紹介します。 Amazon ES は 2015 年にリリースされた、オープンソースの Elasticsearch を大規模かつ簡単でコスト効率の良い方法を使用してデプロイ、保護、実行する完全マネージド型サービスです。ストリームデータの分析を行いたい、全文検索エンジンを構築したい、といったときに手軽にご利用いただけます。ただ実際に Amazon ES を試そうとしたときによく当たるのが、ログ分析に適したストリームデータを生成するのが意外に面倒ということです。 ワークショップで構築する仕組みは、以下の図のようになっています。Amazon Kinesis Data Generator (KDG)というデータ生成ツールを使って、Amazon Kinesis Data Firehose 経由でデータを Amazon ES に挿入します。 この中でも特に注目すべき機能について、軽くご紹介します。  この記事では Amazon Elasticsearch Service Intro Workshop についてご紹介させていただきました。初心者向けの Amazon ES の基本機能、および最近追加された新機能について手軽にお試しいただけますので、ぜひ実際に動かしていただければと思います。
45,08 MAY 2020,Amazon Aurora マルチマスタークラスターが東京リージョンに対応しました | Amazon Web Services ブログ,アマゾン ウェブ サービス ジャパン、シニアエバンジェリストの亀田です。 Amazon Auroraのマルチマスタークラスター機能が東京リージョンに対応しましたのでお知らせいたします。 Amazon Auroraは、MySQL および PostgreSQL と互換性のあるクラウド向けのリレーショナルデータベースであり、従来のエンタープライズデータベースのパフォーマンスと可用性に加え、オープンソースデータベースのシンプルさとコスト効率性も兼ね備えたAWSにより設計されたデータベースです。また、商用データベースと同等のセキュリティ、可用性、信頼性を、10 分の 1 のコストで実現します。 マルチマスター機能は、複数のアベイラビリティーゾーンにわたってAuroraデータベースの複数の読み書きインスタンスを作成できる単一のデータベースであり、稼働時間に敏感なアプリケーションがインスタンス障害を通じて継続的な書き込み可用性を実現できるようにします。この機能のご利用には、MySQL 5.6 と互換性のある Aurora MySQL バージョン 1 が必要です。    マルチマスタークラスターでは、すべての DB インスタンスで書き込みオペレーションを実行できます。単一の読み書きプライマリインスタンスと、複数の読み取り専用 Aurora レプリカの概念は適用されません。別の書き込み DB インスタンスを使用して、失敗したインスタンスの作業を引き継ぐことができるため、書き込み DB インスタンスが利用できなくなっても、フェイルオーバーが発生することのない、継続的な可用性を実現可能です。 その一方で従来のAuroraと動作が異なる点が多くあるため、利用には事前の検証を推奨しています。
46,08 MAY 2020,Amazon WorkSpacesをSAP Single Sign-Onと統合する方法 | Amazon Web Services ブログ,SAP Single Sign-Onにより、ユーザーは、システムがオンプレミスであろうとクラウドであろうと、集中認証を使用してSAPと非SAPシステムに安全に接続できます。SAP Single Sign-Onは、ユーザー認証と安全なデータ通信を管理し、2要素認証とリスクベース認証を統合するシンプルさを提供します。これには、携帯電話とRSA SecurIDカードの連携も含みます。さらに、SAP Single Sign-Onは、Kerberos/SPNEGO、X.509証明書やセキュリティ・アサーション・マークアップ言語 (SAML)など、様々な種類の認証方法をサポートしています。このブログでは、Kerberos/SPNEGOを基盤としたSAP Single Sign-On (*)をAmazon WorkSpacesと統合する方法を説明します。また、世界中の従業員に対して数千のデスクトップを迅速に提供するために、クラウド、あるいはオンプレミス環境にある既存のActive Directoryサービスを使用する方法についても説明します。 (*) SAPノート 1848999に基づいて、SAP Single Sign-Onのライセンスが必要になります。このブログでは、Windows 10でのGUI導入を説明します。 次の手順では、SAP GUIログオンエントリーを同じAmazon FSxファイルシステムで共有する2つのAmazon WorkSpacesを示しています。ドメインの他のAmazon WorkSpacesユーザーは、SAPシステムへのSSOを使用できます。
47,07 MAY 2020,[AWS Black Belt Online Seminar] Amazon Elastic Container Service (Amazon ECS) 資料及び QA 公開 | Amazon Web Services ブログ,先日 (2020/04/22) 開催しました AWS Black Belt Online Seminar「Amazon Elastic Container Service (Amazon ECS)」の資料を公開しました。当日、参加者の皆様から頂いた QA の一部についても共有しております。     AWS クラウドサービス活用資料集（すべての過去資料が閲覧できます） Q. AWS CodeDeploy を利用してデプロイをしていますが、一時的にタスクが2つ立ち上がってしまうため、コンテナインスタンスを通常時の2倍のメモリ量で用意しておかないとデプロイが成功しません。また、セキュリティグループをご利用いただけますので、そちらでアクセスの制御が可能です。 — 直近で以下を予定しています。皆様のご参加をお待ちしております。 また、皆さまよりいただいたアンケートを元に、人気が高かったセッションを Top 10 形式で掲載しております。コンテナ、機械学習、モバイルなど、モダンアプリケーションの開発に欠かせないテクノロジーに関するセッションも、アーリーステージの方々にとって必要な視点で編集しており、明日から使える実践的な内容となっています。 日時：　5 月 11 日（月） 15:00 – 17:40 終了予定 | 詳細・お申込みについてはこちら≫ — AWS Black Belt Online Seminar 5 月のアジェンダが公開されました。配信当日は Q&amp;A ができます。
48,07 MAY 2020,フリートプロビジョニングを用いて、IoTデバイスとAWS IoT Coreの初期セットアップを自動化する方法 | Amazon Web Services ブログ,お客様は AWS IoT を使用してIoTデバイスによって生成されたデータを分析し、ビジネスに関する有意義な洞察をすばやく得ることができます。これにより、製造プロセスに必要な改善点の特定、デバイス障害の予測、デバイス問題の迅速な診断とトラブルシューティングなど、さまざまな問題を解決するのに役立ちます。ただし、一意の ID を安全に生成してデバイスに書き込むことは、依然としてお客様の責任です。これらのブートストラップ証明書には、デバイスに次のことのみを許可します。 ポリシーは、接続や特定のトピックのサブスクライブ、受信など、デバイスが AWS IoT Core エンドポイントとのやりとりで必要となるアクセスを管理します。 ステップ 2でブートストラップ証明書を生成した場合は、証明書、ルートCA証明書、および秘密鍵が AWS IoT Console からダウンロードされ、デバイスの安全な場所に保存されていることを確認します。 ブートストラップ認証情報がボードに安全に保存されていることを確認したら、デバイスは AWS IoT Core への初期接続を行う必要があります。 次の例は、デバイスをAWS IoT Coreに接続する方法を示しています。 証明書とキーはセキュアに保存される必要があります。 デバイスによっては、安全なハードウェアベースのソリューションを使用してキーペアを生成することが可能です。
49,07 MAY 2020,週刊AWS – 2020/4/27週 | Amazon Web Services ブログ,みなさん、こんにちは。ソリューションアーキテクトの下佐粉です。 今週も週刊AWSをお届けします。ゴールデンウィークのために今回は木曜日の発行です。 最近、PCの録音環境を改善するためにオーディオインターフェースを買おうと思いたって、色々調べていました。たくさんの製品があるのですね。知識が全然無いので「XLRとは」みたいなところからの学習だったのですが、予算や機能から自分の買いたい製品候補を調べていくのは結構楽しかったです。 それでは、先週の主なアップデートについて振り返っていきましょう。この後もスペインやジャカルタでの新リージョン、また2021年には大阪ローカルリージョンのフルリージョン化が予定されています。 それでは、また来週！ ソリューションアーキテクト 下佐粉 昭 (twitter – @simosako)。
50,07 MAY 2020,Amazon Kinesis Data Firehose により、VPC のプライバシー内で Amazon Elasticsearch Service にストリーミングデータを取り込む | Amazon Web Services ブログ,これにより、Kinesis Data Firehose から Amazon Elasticsearch Service ドメインへの VPC 配信をセットアップできます。Amazon Kinesis Data Streams でカスタムアプリケーションを管理してトラフィックを非公開にしている場合は、Kinesis Data Firehose を使用して、VPC 内の Amazon Elasticsearch Service エンドポイントにデータをロードすることができます。それを行うのに、取り込みと配信のインフラストラクチャに投資、運用、拡張する必要はありません。Kinesis Data Firehose コンソール、AWS CLI、および API からこの新機能の使用を開始するには、宛先として Amazon Elasticsearch Service、VPC がアクセスできる特定のドメインを選択し、サブネットとオプションのセキュリティグループで VPC を設定します。 Amazon Elasticsearch Service ドメインは、パブリックまたはプライベートエンドポイントを持つことができます。パブリックエンドポイントは、パブリックインターネット上の IP アドレスでバックアップされています。この新機能により、Kinesis Data Firehose は Amazon Elasticsearch Service VPC エンドポイントへ安全な方法で通信できます。 Kinesis Data Firehose エンドポイントと Amazon Elasticsearch Service エンドポイントに同じセキュリティグループを使用することもできます。 この新機能の使用方法を示すために、この記事では、Kinesis Data Firehose コンソールで利用できるストックデモデータを使用して、VPC内 の Amazon Elasticsearch Service エンドポイントに配信します。さらに、Amazon Elasticsearch Service エンドポイントへのパブリックアクセスを有効にして保護する必要はありません。
51,07 MAY 2020,Amazon Redshift マテリアライズドビューで ELT と BI クエリを高速化 | Amazon Web Services ブログ,﻿ Amazon Redshift のマテリアライズドビュー機能は、Amazon QuickSight などのビジネスインテリジェンス (BI) ツールからのダッシュボードクエリといった反復または予測可能なワークロードで、大幅に高速なクエリパフォーマンスを実現するために役立ちます。これは、ETL (抽出、変換、ロード) データ処理も高速化およびシンプル化します。マテリアライズドビューは、頻繁に使用される事前計算を保存し、それらをシームレスに使用して後続の分析クエリでの低レイテンシーを達成するために利用できます。 この記事では、マテリアライズドビューを作成する、データ取り込み後にビューを更新する、および BI ワークロードを高速化する方法を説明します。 このチュートリアルでは、Amazon Customer Reviews Dataset を使用します。これは、us-east-1 リージョンに保存されている公開データセットです。 以下の図は、これら 3 つのテーブルの関係を示すものです。 以下のコードは、マテリアライズドビューに照らして製品レビューを分析するためのレポートです。このチュートリアルでは、マテリアライズドビューを Amazon QuickSight データセットのソースとして選択します。  マテリアライズドビューを使用しているため、製品動向ダッシュボードは数秒でロードされ、常に最新です。
52,07 MAY 2020,Amazon A2I の一般公開を開始しました | Amazon Web Services ブログ,﻿ AWS では、この度 Amazon Augmented AI (Amazon A2I) の一般公開を発表できることを、とても喜ばしく思っております。これは、機械学習 (ML) によるヒューマンレビューを大規模に実装できるようにするサービスです。Amazon A2I は、ヒューマンレビューシステムの構築や管理に関する、コストが高い上に煩雑になりがちで代わり映えのしない重労働を削減します。これを使えば、お客様の ML モデルで正確な予測生成を確実に実現することができます。Amazon A2I は、人間の判断を ML パイプラインの中に挿入することで、人間と機械が最良の結果を出せるようにしました。 Amazon A2I には、一般的な ML タスク用にヒューマンレビューのワークフローが実装済みです。これらのタスクには、Amazon Rekognition や Amazon Textract と組み合わせて実行する、ドキュメントでのコンテンツ修正やテキスト抽出などが含まれます。 さらに Amazon A2I では、人間のレビュー担当者が介在することができます。 Amazon A2I は、その他のサービスと組み合わせても機能します。Amazon Textract を経由してドキュメントが供給されると、設定したビジネスルールに基づき 信頼性の低い予測結果が、Amazon A2I によりヒューマンレビューに送られます。
53,07 MAY 2020,Amazon FSx for Lustre による高パフォーマンスワークロード用の永続的ストレージ | Amazon Web Services ブログ,﻿ 高パフォーマンスなファイルシステムは、しばしばスクラッチファイルシステムと永続的ファイルシステムの 2 種類に分類されます。スクラッチファイルシステムとは、一時的な高性能のストレージを提供するためのものです。その性能は、1 ミリ秒未満のレイテンシーで、スループットは最大で毎秒数百ギガバイト、そして短時間のワークロード用に数百万の IOPS を実現します。対照的に、永続的ファイルシステムでは、スクラッチファイルシステムに備わったパフォーマンスレベルに、より長期にわたるデータ処理で必要となる耐久性と可用性を組み合わせるよう設計されています。AWS は、re:Invent 2018 において、世界でも最もよく使用されている高パフォーマンスファイルシステムである Lustre をベースとしたスクラッチファイルシステム Amazon FSx for Lustre (FSx for Lustre) を発表しました。さらに、FSx for Lustre の永続的ファイルシステムを新規で作成し、マウントも行ってみます。 FSx for Lustre の永続的ファイルシステムは、実行時間が長め、もしくは永続的なワークロードに対し、高可用性で耐久性のあるストレージを提供します。  耐久性と可用性が高いストレージが要求される処理が重いワークロードに対しては、永続的ファイルシステムの使用を検討します。この例のファイルシステムは、Amazon Simple Storage Service (Amazon S3) が提供する耐久性のあるデータレポジトリにリンクしています。ファイルシステムで、設計された最高のスループットを発揮させるためには、ワークロードの並列化もご検討くだい。
54,07 MAY 2020,新機能 – AWS Glue を使用したサーバーレスストリーミング ETL | Amazon Web Services ブログ,﻿ アプリケーションが本番環境にあるとき、何が起こっているか、どのようにアプリケーションが使われているかを把握する必要があります。データ分析の最初のアプローチはバッチ 処理モデルで、一連のデータを一定期間収集し、分析ツールで実行します。迅速に対応したい場合には、ストリーミングモデルを使用します。このモデルでは、データの到着時にデータ処理し、一度に 1 レコードずつ、または数十、数百、数千のレコードのマイクロバッチで処理します。 継続的な取り込みパイプラインの管理や即時的なデータ処理は、管理、パッチ適用、スケーリング、一般的な対応を必要とする常時オンのシステムであるため、大変複雑です。ここで列を指定しないと、ストリームの処理時に無視されます。 ストリーミングデータを処理するには、Glue ジョブを作成します。Glue PySpark 変換または Spark Structured Streaming がサポートしている変換を適用できます。 S3 バケットのコンテンツに基づくテーブルを Glue データカタログに入力するには、クローラを追加して実行します。 これらの新しい機能を皆さんがどのように活用しているか、ぜひお知らせください。
55,07 MAY 2020,Zendesk がレガシーシステムを Amazon Aurora と Amazon Redshift に移動してパフォーマンスを 3 倍にした方法 | Amazon Web Services ブログ,﻿ この記事は、Zendesk のエンジニアリングリーダーである James Byrne 氏によるゲスト投稿です。Zendesk は、Zendesk Explore アナリティクス製品のデータパイプラインにおける開発と運用、および AWS ソリューションアーキテクトの Giedrius Praspaliauskas に焦点を当てています。 Zendesk は、より良い顧客関係を促進するために設計されたサポート、販売、顧客エンゲージメントソフトウェアを構築する CRM 企業です。規模、業界、または野心に関係なく、大企業からスタートアップ企業にいたるまで、強力で革新的な顧客体験がすべての企業に届くと、私たちは信じています。Zendesk は、さまざまな業界の 150000 社以上の顧客に 30 以上の言語でサービスを提供しています。Zendesk はサンフランシスコに本社を置き、世界中に 17 ヵ所のオフィスを展開しています。 Zendesk Explore は、企業が顧客体験全体を測定して改善できるように分析を提供します。 2015 年、Zendesk はビジネスインテリジェンスのスタートアップ企業である BIME Analytics を買収しました。次のサービスは、さまざまな機能を実行します。Amazon Redshift は大規模な顧客をホストしています。
56,07 MAY 2020,Amazon DynamoDB 向け NoSQL Workbench を使用したデータモデリング | Amazon Web Services ブログ,﻿ Amazon DynamoDB などの NoSQL データベースを使用する場合、リレーショナルデータベースで慣れているものとは異なる最適化を選択する傾向があります。リレーショナルデータベースの経験から、最初は別の方法で実行するように指示されていたため、簡単ではありませんでした。 これを支援するために、AWS は Windows および macOS で利用可能なクライアント側アプリケーションである Amazon DynamoDB 向け NoSQL Workbench をリリースしました。これを使用して、スケーラブルで高性能なデータモデルを構築し、クエリの開発とテストを簡素化できます。NoSQL Workbench を使用すると、次のことができます。 このブログ記事では、一般的に利用可能になった NoSQL Workbench を使用して、複数の顧客の URL ブックマークの管理という一般的なユースケースのデータモデルを設計しています。比較的ユースケースが単純な場合でも、多くの興味深い考慮事項があります。 このアプリケーションでは、ブックマークと顧客アカウントに関する情報を保存する必要があります。 NoSQL データベースを使用する場合は、アプリケーションのアクセスパターンに合わせて最適化するようにデータモデルを設計する必要があります。このように、ソートキーはオーバーロードされた属性であり、その一般的な名前として sk を使用しています。
