57,07 MAY 2020,AWS DataSync を使用してネットワークファイル共有を Amazon WorkDocs に移行する | Amazon Web Services ブログ,﻿ 今日、多くの AWS のお客様は、Amazon WorkDocs を使用して、料金が高額なネットワークファイル共有を廃止し、コンテンツをクラウドに移動しています。WorkDocs の従量課金制の料金では、お客様は、WorkDocs サイトのアクティブなユーザーアカウントに対してのみ支払います。WorkDocs は安全なクラウドストレージを提供するだけでなく、ユーザーが他の内部および外部ユーザーとコンテンツを簡単に共有できるようにします。さらに、Amazon WorkDocs Drive を使用すると、ローカルのディスク容量を消費することなく、Windows ファイルエクスプローラー、Mac Finder、またはAmazon WorkSpaces からコンテンツを直接立ち上げることができます。これにより、ユーザーのフリクションが最小限に抑えられ、クラウドベースのファイル共有を採用するための学習曲線が短縮されます。AWS DataSync コンソールの ロケーション ページに移動すると、NFS または SMB ソースのロケーションを作成できます。DataSync コンソールの ロケーション ページに移動すると、Amazon S3 の移行先ロケーションを作成できます。 ファイルとフォルダを WorkDocs に移行するには、次のタスクを実行します。WorkDocs サイトからランディングページにアクセスするには、アプリ と 移行 を選択します。ユーザーは、ネイティブデスクトップファイルシステム、またはウェブやモバイルインターフェイスを使用して、個人およびチームの共有コンテンツすべてに引き続きアクセスできます。
58,07 MAY 2020,AWS CLI を使用した既存の Amazon S3 オブジェクトの暗号化 | Amazon Web Services ブログ,﻿ 業界のプロトコル、政府の規制、組織内部のセキュリティ標準が変化する中、保存データの暗号化がますます必要とされています。暗号化は、不正アクセスやその他のセキュリティリスクから保存データを保護するためのものです。 Amazon S3 のデフォルトの暗号化を使用しても、バケット内の新しいオブジェクトを自動で暗号化できます。しかし、デフォルトの暗号化では、同じバケット内の既存のオブジェクトの暗号は変更されません。暗号化が必要な既存のオブジェクトが Amazon S3 バケットにある場合や、使用しているサーバー側の暗号化 (SSE) 設定を変更したい場合があります。S3 バケット内の既存のオブジェクトを暗号化する最も簡単な方法について、お客様から質問されることがよくあります。 この投稿では、コピーオブジェクト API を使用する際に考慮すべき重要事項について説明します。 この投稿で説明しているコマンドを実行するには、次のものが必要です。こちらで説明しているコマンドを実行すると、新しい暗号化バージョンが生成されます。さらに、オブジェクトを暗号化する際に考慮すべきいくつかの事項と推奨事項についても説明しました。
59,07 MAY 2020,Microsoft Azure AD シングルサインオンで Amazon Redshift アクセスをフェデレーションする | Amazon Web Services ブログ,﻿ 最近、当社は、Azure AD を企業ディレクトリとして使用して、Amazon Redshift にデータウェアハウスを構築している大企業のお客様を支援しました。データウェアハウスのユーザーが企業の認証情報を使用して Redshift でデータをクエリできるようにすることが要件となっていました。これにより、ユーザーは企業の認証情報を利用でき、追加のパスワードを覚える必要がなくなるので、ユーザーエクスペリエンスが向上します。また、すべての企業ユーザーが 1 か所で管理されるため、メンテナンスが容易になります。ソリューションは、Redshift への Azure AD フェデレーションアクセスをセットアップすることでした。 フェデレーションを使用して、Amazon Redshift へのアクセスを集中管理できます。これにより、一元的なロケーションでユーザーアクセスを制御できるようになり、データベースユーザーの作成と保守のオーバーヘッドが削減されるため、管理が簡素化されます。Azure AD は、ユーザーを管理し、IAM を使用して Amazon Redshift へのフェデレーションアクセスを提供します。 SQL クライアントを使用して Amazon Redshift にシームレスにアクセスできるように Azure AD と IAM 間のフェデレーションを設定するソリューションには、次のコンポーネントが含まれています。 これで、Azure にエンタープライズアプリケーションがセットアップされました。
60,07 MAY 2020,New – Amazon Keyspaces (Apache Cassandra 用) が正式リリース | Amazon Web Services ブログ,"﻿ 昨年の re:Invent で、Amazon Managed Apache Cassandra Service (MCS) のプレビュー版を紹介しました。過去数か月の間に、このサービスは多くの新機能を導入し、今日 Amazon Keyspaces (Apache Cassandra 用) という新しい名前で一般公開します。 Amazon Keyspaces は Apache Cassandra 上に構築されており、フルマネージドのサーバーレスデータベースとしてご利用いただけます。アプリケーションは、既存の Cassandra Query Language (CQL) コードを使用して、まったくまたはほとんど手を加えずに Amazon Keyspaces からデータを読み書きできます。各テーブルでは、以下のように、ユースケースに応じて最適な設定を選択できます。 Amazon Keyspaces の使用 私が子供の頃に構築した最初の「本格的な」アプリケーションの 1 つは、本用のアーカイブでした。 プレビューのブログ記事では、コンソールを使用してデータモデルを設定しました。ここで、テーブルのすべての行を選択します。 $ curl -i https://a1b2c3d4e5.execute-api.eu-west-1.amazonaws.com/books/978-0201896831 HTTP/1.1 200 OK { ""isbn"": ""978-0201896831"" ""title"": ""The Art of Computer Programming Vol. 1: Fundamental Algorithms (3rd Edition)"" ""author"": ""Donald E. Knuth"" ""pages"": 672 ""year_of_publication"": 1997 } その ISBN では何も本が見つからなかった場合、「not found」というメッセージが返されます。 今すぐご利用いただけます Amazon Keyspace (Apache Cassandra 用) をお客様の用途にご利用いただけるようになりました。"
61,07 MAY 2020,AWS Snowball Edge と Amazon EC2 を使用して Linux エッジコンピューティングソリューションを構築する | Amazon Web Services ブログ,﻿ データソースの近くでデータ推論を実行しなければならない状況は数多くあります。多くの場合、これらはリモートであり、接続がない場所で生じます。 これらすべてのシナリオでは、データソースの近くでコンピューティング、ストレージ、ネットワークを実行することを要します。これらの問題は、実行のために構築されたデータセンタースペースを必要としない高耐久性デバイスである AWS Snowball Edge デバイスを使用して解決できます。Amazon S3、Amazon EC2、Amazon EBS、AWS IoT Greengrass などのクラウドネイティブなサービスや、データを取り込むために Network File System (NFS) インターフェイスを実行できます。 このブログ投稿では、AWS Snowball Edge デバイスを使用した Linux ベースのエッジコンピューティングソリューションを開始する方法について説明します。 3. ワークステーションから Snowball Edge デバイスに次のネットワークポートを開く必要があります。この手順を実行するには、Snowball Edge クライアントと AWS CLI をダウンロードしてインストールする必要があります。 この投稿では、エッジコンピューティングのユースケースを実行するために Snowball Edge デバイスを注文する方法を示しました。 この投稿全体で概要を説明して説明した手順を実行することで、AWS Snowball Edge を使用して強力なエッジコンピューティングプラットフォームをデプロイできます。
62,07 MAY 2020,Udacity の AWS Machine Learning Engineer Nanodegree プログラムの奨学金でキャリアアップ | Amazon Web Services ブログ,﻿ 機械学習 (ML) は、テクノロジーで最も急速に成長している分野のひとつで、今日の求人市場において極めて高い人気があります。  AWS と Udacity は、あらゆるスキルレベルの開発者に ML の開始方法に関する教育を受ける機会を与えるために手を組んでいます。   奨学金プログラムは 2020 年 5 月 19 日から始まり、2020 年 7 月 31 日まで実施されます。ML 学習を進めるには、今すぐ登録してください。 AWS Machine Learning Foundations コースは、あらゆるスキルレベルの開発者が ML を使い始めるのをサポートすることを目的としています。基礎コースのカリキュラムでは、オブジェクト指向プログラミング (OOP)、クリーンなコードの記述、コードのテスト、scikit-learn、PyPI　へのコードの配置など、ソフトウェアおよびエンジニアリング手法に関する知識を構築します。基本的なソフトウェアエンジニアリングスキルを構築するだけでなく、教師あり学習や教師なし学習など、ML スキルの中級レベルの知識も構築します。得点上位者は、Udacity が後援する Udacity Machine Learning Engineer Nanodegree プログラムの全額給付の奨学金 (給付対象者数: 325 名) を獲得します。 開発者の皆さん、ML を始めましょう! 奨学金プログラムは 2020 年 5 月 19 日から開始されます。Tara は現在、ML 開発者の卵が ML におけるスキルを伸ばすことができるように助けるユニークかつスケーラブルな教育コースの構築に携わっています。
63,07 MAY 2020,Amazon QuickSight ML Insights を使用して、データから異常を見つけ、将来を予測する | Amazon Web Services ブログ,﻿ テクノロジーの進化に伴い、ビジネスは多種多様なソースから、より多くのデータを収集するようになってきています。集めるデータポイントが多くなりすぎると、ビジネスの成長に役立つ適切な知見を見出すことがしばしば難しくなります。ダッシュボードは、構築の仕方によっては、データを視覚的に表現することに優れていますが、データから異常や外れ値といった隠れた知見を見つけるとなると、必ずしも優れた手段とは言えません。人がデータを探す際には役立ちますが、データ自らが人にアピールしてくれるわけではありません。データ収集の規模が大きくなると、間接費の増大を避けるためにも前者から後者に移行する必要があります。 こうした限界から、情報に基づいて意思決定を下すことができなくなる恐れがあります。さらに、何百万ものメトリクスや何十億もの大規模データポイントから、深い知見を得ることができます。 異常検出は、全国の複数の拠点で事業を行っている航空会社など、他のビジネスにも役立ちます。 さらに、事前構築済の計算セットからカスタムインサイトを追加することもできます。彼は、10 年以上にわたって大企業の顧客向けに IT 業務をした経験があります。
64,07 MAY 2020,AWS Glue の自動コード生成機能とワークフローを利用して、データパイプラインをシンプル化する | Amazon Web Services ブログ,﻿ これまでの一連の記事では、AWS Glue のジョブブックマークを使用して Amazon S3 やリレーショナルデータベースからデータを増分ロードする方法についてご紹介しました。また、AWS Glue に最適化された Apache Parquet ライターを使用してパフォーマンスを向上させ、スキーマ進化を管理する方法についても説明しました。まず、特定の列を選択する、深くネストされたレコードを展開する、ネストされたフィールドを効率的に解析 (パース) する、列データの展開処理といった一般的なユースケースにおいて、AWS Glue でデータの変換に役立つコードを自動生成方法について説明します。 AWS Glue では、さまざまなデータ変換タスクの実行に使用するコードを自動的に生成できます。たとえば、一部のリレーショナルデータベースやデータウェアハウスは、ネストされたデータ構造をネイティブにサポートしていません。Dynamic Frames では、ResolveChoice を使用した型の変換が可能です。 ETL ワークロードの典型的なワークフロー編成は次のとおりです。 S3 からデータを読み込む AWS Glue DynamicFrame API でも、上と同様のアプローチが使用されます。その後、DynamicFrame は toDF メソッドを使用して Spark DataFrame に変換されます。 この記事では、AWS Glue ETL の自動コード生成プロセスを活用して、データ型の変換や複雑な構造の展開といった一般的なデータ操作タスクをシンプル化する方法について説明しました。
65,07 MAY 2020,AWS COVID-19 パブリックデータレイクの探索 | Amazon Web Services ブログ,AWS COVID-19 のデータレイク — 新型コロナウイルス (SARS-CoV-2) とこれに関連する病気である COVID-19 の広がりおよび特性についての、またはそれに関する最新のデータセットが収集され、一元化されたリポジトリが現在利用可能になりました。詳細については、COVID-19 データの分析用のパブリックデータレイクをご参照ください。世界的には、このデータを収集するためにいくつかの取り組みが進行中であり、AWS はパートナーと協力して、この重要なデータを自由に利用できる状態にし、最新の状態に保てるように尽力しています。 このデータは、質問、独自のデータセットとの混合、独自のデータレイクへの新しい洞察の取り込みを行うためにすぐに利用できます。AWS は、パンデミック監視手法の開発研究を行うノースウェスタン大学をサポートしています。このデータレイクを使用して構築できる対象については、GitHub で公開されている関連 Jupyter ノートブックを参照してください。COVID-19 データの選択については、研究開発で利用可能な COVID-19 に関連するデータを参照してください。手順については、COVID-19 データの分析用のパブリックデータレイクをご参照ください。 最初のステップでは、AWS CLI をインストールして、us-east-2 リージョン用に構成します。彼は現在、お客様がプロフェッショナルサービス内の AWS でデータレイクと分析を形作るよう支援しています。
66,07 MAY 2020,新規オープン – AWS 欧州 (ミラノ) リージョン | Amazon Web Services ブログ, 各 AZ は、AWS のインフラストラクチャの完全に隔離されたパーティションで、1 つ、または複数のデータセンターが含まれます。これは、単一のデータセンターで実現できるものよりも、可用性、耐障害性、およびスケーラビリティに優れた本番アプリケーションを運用する能力を提供します。Amazon Simple Storage Service (S3)、AWS Lambda、および Amazon DynamoDB などの完全マネージド型サービスは、自動的にデータとアプリケーションを複数の AZ にレプリケートします。その成果は、エンドユーザーのラストマイルネットワークにおける接続の品質、キャパシティー、および距離に応じて異なる場合があります。 イタリアの AWS 現在 AWS には、イタリアに 5 つのエッジロケーション (ミラノに 3 つ、パラモとローマに 1 つずつ)、およびミラノに欧州 (フランクフルト) リージョンとミラノの新しいリージョンを接続する AWS Direct Connect ロケーションがあります。 AWS は、2014 年初頭にミラノでイタリア初の AWS オフィスを開設しましたが、今ではミラノにもオフィスがあり、ピエモンテ州とサルデーニャにエンジニアリングチーム、そして幅広いパートナーネットワークを持っています。 AWS では、あらゆる規模のお客様がクラウドでワークロードを構築、またはそれらをクラウドに移行させるお手伝いをするために、アカウントマネージャー、ソリューションアーキテクト、ビジネス開発者、およびプロフェッショナルサービスコンサルタントのチームをイタリアで構築し続けています。 今すぐご利用いただけます 新しい欧州 (ミラノ) リージョンは、今すぐ皆さんのビジネスをサポートできます。 このローンチにより、AWS のアベイラビリティーゾーンは全世界 24 の地理的地域内に 76 個となりました。インドネシア、日本、およびスペインに も 3 つの AWS リージョンが追加される予定です。
67,07 MAY 2020,AWS DeepLens と Amazon Rekognition を使用してスマートガレージドアオープナーを構築する | Amazon Web Services ブログ,﻿ 小売、製造、ヘルスケアを含む多くの業界が IoT 対応デバイスを採用し、AI または機械学習 (ML) テクノロジーを使用して、デバイスが人間の介入なしに人間のような意思決定を行えるようにしました。自宅で AI/機械学習テクノロジーを使用して IoT 対応デバイスに電力を供給するなど、いくつかのユースケースを適用することもできます。 この記事では、AWS DeepLens、Amazon Rekognition、およびその他の AWS サービスを使用して車のナンバープレートを認識し、IoT ベースのガレージドアオープナーをトリガーする方法を紹介します。このソリューションを他の多くのユースケース (製造業など) に適用して、生産現場でのロボットやパッケージのフローを制御することができます。  AWS DeepLens デバイスを使用すると、エッジで深層学習を実行することができます。 このプロジェクトでは、以下の AWS のサービスを使用します。 この手順では、ナンバープレート番号を DynamoDB テーブルに入力します。 端末から次のコードを入力して、AWS CLI で前述の手順を完了することもできます。 この記事では、実際の問題を解決するためにエッジで機械学習を使用する方法を示しました。 このプロジェクトでは、開発者を機械学習と IoT へ手引きする際の AWS DeepLens デバイスの機能を紹介しました。
68,07 MAY 2020,新情報 – VPC エンドポイント向け Amazon Simple Email Service (SES) | Amazon Web Services ブログ,﻿ チャットやメッセージングアプリケーションも広く普及しましたが、メールは最も投資利益率 (ROI) の高いユビキタスチャネルとして人気を維持しています。参入のハードルの低さ、価格の安さ、特定の受信者をターゲティングする機能が特徴です。組織のマーケティングおよび取引のメッセージがタイムリーに顧客に届き、より深いエンゲージメントを促進していることを確認するには、大規模なメール配信における専門知識を培ってきた、経験豊富で信頼できるメールサービスプロバイダーと連携する必要があります。 Amazon Simple Email Services (SES) は信頼性と柔軟性に富んだ手ごろな価格のメールサービスプロバイダーとして、2011 年から開発者およびデジタルマーケター向けにサービスを提供してきました。多くの企業が、機密性が高く、厳しいセキュリティポリシーを保持する業界に属しています。そのため AWS は Amazon SES のセキュリティおよびコンプライアンスの機能を強化しました。複数アカウントのインフラストラクチャの Amazon SES を一元化し、インターネットゲートウェイを活用することなく、サービスとしてアカウントに提供することが可能です。 VPC エンドポイントは現時点において、地域間のリクエストをサポートしていません。 今すぐご利用いただけます! VPC エンドポイント向けの Amazon SES は一般提供されています。VPC エンドポイント向けの Amazon SES の使用に、追加の費用は発生しません。
69,07 MAY 2020,Amazon SageMaker Debugger を使った機械学習の説明可能性 | Amazon Web Services ブログ,﻿ 機械学習 (ML) は、金融サービス業界 (FSI) から製造、自律走行車、および宇宙探査にいたるまで、世界中の業界に影響を及ぼします。ML はもはや学術機関および研究機関限定の単なる野心的なテクノロジーではなくなり、あらゆる規模の組織に利益をもたらす主力テクノロジーへと進化しました。しかし、ML プロセスにおける透明性の欠如と、結果として生じるモデルのブラックボックス的な性質が、金融サービスおよびヘルスケアなどの業界における ML の導入を向上させる上での妨げとなっています。これは、設計者でさえも AI が特定の結論に達した理由を説明できないというブラックボックスの概念とは対照的なものです。これは、モデル予測の消費者の安心感を高めます。 収集されたテンソルを表示するには、以下のコードを入力します。これには、どの特徴が最も重要か、およびデータセットに対するそれらの影響範囲も示されています。また、個人の性別 (Sex) が予測にマイナスの影響を与えることもわかります。また、個人の所得予測に関する金融サービスユースケースの ML モデルのトレーニングを一通り説明する詳細なノートブックも提供しました。       Sireesha Muppala は AWS の AI/ML スペシャリストソリューションアーキテクトで、大規模な機械学習ソリューションの設計と実装に関するガイダンスをお客様に提供しています。
